{
  "allow_allocator_publish": false,
  "allow_db_write": false,
  "baseline_comparison_sha256": "f9c2bed4eb70784249f95076f4d88609c8391597ec0daabe4fe1d85cfe35da45",
  "calibration_id": "open_macro_v03_calibration_001",
  "correlation_id": "corr-open-macro-v03-external-executor-handshake-001",
  "cpu_time_ms": 1000,
  "divergence_summary": {
    "constraint_violations": 0,
    "invariant_failures": 0,
    "mismatch_count": 0,
    "missing_outputs": 0,
    "nan_or_inf_count": 0,
    "unexpected_outputs": 0
  },
  "duration_ms": 1000,
  "engine_commit": "ee39adbe6cb6541d4fdfa78f1428478ffffaf638",
  "engine_image_digest": "sha256:cdcf05768ad6e44543567cd0b5106ecc2b88a2f49ef5080c25c52a601a91598b",
  "execution_id": "exec-open-macro-v03-external-executor-handshake-001",
  "finished_at": "2026-06-29T17:00:01Z",
  "input_pack_sha256": "ae8b76e5959cb5e9c10ced7b33fc13a01a3484865deeead56c5b83b1c440e08f",
  "invariant_report_sha256": "8ef7e6ea388c2e6d978218031d6f78fb26082f93e72aecd64e9c9674352158ef",
  "materiality_summary": {
    "allocation_weight_delta_pct": 0.0,
    "classification_rate_delta_pct": 0.0,
    "latency_p95_regression_pct": 0.0,
    "material_divergence": false,
    "max_relative_delta_pct": 0.0,
    "memory_peak_regression_pct": 0.0,
    "retry_rate_delta_pct": 0.0,
    "return_metric_delta_pct": 0.0,
    "risk_metric_delta_pct": 0.0,
    "threshold_version": "open_macro_v03_shadow_materiality_v1"
  },
  "memory_peak_bytes": 0,
  "official_result": false,
  "output_artifact_uri": "artifact://shadow/open_macro_v03_shadow_001/open_macro_v03_external_executor_handshake_001",
  "output_manifest_sha256": "ba81b4e6c654d75da20eade6dc4b8727cfca4b1a6c37d60d242800cbcc937284",
  "production_endpoint_activation": "none",
  "reproducibility_report_sha256": "e62005c9adebedea93bb7a21984425b521187700cd10271ed2875a9639d75ce6",
  "request_id": "req-open-macro-v03-external-executor-handshake-001",
  "retry_count": 0,
  "retryable": false,
  "run_fingerprint": "078cef19bdb6ad0de1716dd73a6e6807d45ca4cb6c675838947e2531832c8106",
  "runtime_activation": false,
  "schema_version": 1,
  "shadow_id": "open_macro_v03_shadow_001",
  "started_at": "2026-06-29T17:00:00Z",
  "status": "succeeded"
}
